{
  "schema_version": "1.0",
  "store_id": "entra-production",
  "snapshot_ttl_seconds": 86400,
  "tenants": [
    {
      "entra_tenant_id": "11111111-1111-4111-8111-111111111111",
      "team_tenant_id": "tenant-acme",
      "issuer": "https://login.microsoftonline.com/11111111-1111-4111-8111-111111111111/v2.0",
      "jwks_uri": "https://login.microsoftonline.com/11111111-1111-4111-8111-111111111111/discovery/v2.0/keys",
      "audience": "33333333-3333-4333-8333-333333333333",
      "allowed_client_ids": [
        "44444444-4444-4444-8444-444444444444"
      ],
      "accepted_delegated_scopes": [
        "Causure.Access"
      ],
      "accepted_application_roles": [
        "Causure.Service"
      ],
      "max_token_lifetime_seconds": 7200
    }
  ]
}
